{
  "schema_version": "0.3",
  "report": {
    "report_id": "report:f5d07d2a14c62e74521f",
    "title": "分析故事：QuietVault | Splunk 安全内容",
    "publisher": null,
    "publication_date": {
      "value": "2026-05-13",
      "precision": "day",
      "raw": "2026-05-13T00:00:00+00:00"
    },
    "url": null,
    "file_name": "分析故事：QuietVault _ Splunk 安全内容.html",
    "content_type": "html",
    "language": "zh-CN",
    "content_sha256": "a4c923a99964cd0e0d98754296cb4b1586d78c76807d2bada89514b3ce2bda0a"
  },
  "events": [
    {
      "event_id": "event:771f8401ecca16508ab3",
      "identity": {
        "event_name": "QUIETVAULT",
        "aliases": [],
        "event_type": "malware_operation",
        "evidence_ids": [
          "evidence:1f742b85ab1882f8f364"
        ]
      },
      "time": {
        "start": null,
        "end": null,
        "precision": "unknown",
        "description": null,
        "evidence_ids": []
      },
      "status": {
        "value": "unknown",
        "evidence_ids": []
      },
      "artifacts": [
        {
          "artifact_id": "artifact:a3e2ad04553a500e77ae",
          "family": "QUIETVAULT",
          "aliases": [],
          "sha256": [],
          "file_names": [],
          "role": null,
          "language": null,
          "file_type": null,
          "packer": null,
          "scope": "family",
          "evidence_ids": [
            "evidence:1f742b85ab1882f8f364"
          ]
        }
      ],
      "attribution": {
        "actors": []
      },
      "targets": [],
      "ai_involvement": {
        "roles": [],
        "stages": [],
        "autonomy_level": "unknown",
        "human_role": null,
        "output_handling": "unknown",
        "evidence_ids": []
      },
      "ai_signals": {
        "toolchain": [],
        "prompts": [],
        "code_style": []
      },
      "key_behaviors": [],
      "outcomes": [],
      "limitations": [],
      "evidence": [
        {
          "evidence_id": "evidence:1f742b85ab1882f8f364",
          "block_id": "block:e870752680575d355015",
          "page": null,
          "section": "描述",
          "excerpt": "QUIETVAULT 是一款基于 JavaScript 的凭证窃取恶意软件，由谷歌威胁情报小组发现。该恶意软件以 GitHub 和 npm 令牌为目标，会将这些令牌窃取到可公开访问的 GitHub 代码库中。除了窃取这些凭证外，QUIETVAULT 还利用主机上安装的 AI 命令行工具和精心设计的 AI 提示，在受感染的系统中搜索其他敏感信息，并将其窃取。这反映了威胁行为者将 AI 驱动的工具集成到恶意软件中的更广泛趋势，旨在增强实际操作中的自动化发现和数据窃取能力，标志着恶意软件正朝着更具适应性和智能性的方向发展。",
          "excerpt_sha256": "63c5e19e02ad5b8184cc7995bc5ff477ac8e95e819f53a971a1eebc5dcc1961a"
        }
      ]
    }
  ],
  "extraction": {
    "pipeline_version": "0.3",
    "extractors": [
      {
        "name": "document-parser",
        "version": "html"
      },
      {
        "name": "deterministic-event-index",
        "version": "0.3"
      },
      {
        "name": "evidence-field-rules",
        "version": "0.3"
      }
    ],
    "validation_status": "passed",
    "review_status": "not_reviewed",
    "errors": []
  }
}